{
  "name": "fixture-long-revision",
  "version": 1,
  "start": "plan",
  "done": "done",
  "steps": {
    "plan": {
      "name": "Plan",
      "kind": "worker",
      "input": {
        "prompt": "Plan the work."
      },
      "output": {
        "template": "output.md",
        "schema": "schemas/plan-approval-ready.schema.json"
      },
      "next": "approval_gate"
    },
    "approval_gate": {
      "name": "Approval Gate",
      "kind": "approval",
      "input": {
        "summary": "${{ input.plan.outcome }}",
        "artifacts": ["${{ input.plan.artifacts }}"]
      },
      "next": {
        "match": "${{ output.approval }}",
        "cases": {
          "approved": "implement",
          "rejected": "plan"
        }
      }
    },
    "implement": {
      "name": "Implement",
      "kind": "worker",
      "input": {
        "prompt": [
          "Implement the approved plan.",
          "",
          "Plan result:",
          "${{ input.plan.results }}",
          "",
          "Approval decision:",
          "${{ input.approval_gate }}",
          "",
          "Review feedback to address:",
          "${{ input.review.results | default: \"No review feedback yet.\" }}"
        ]
      },
      "output": {
        "template": "output.md",
        "schema": "schemas/routing-ready.schema.json"
      },
      "next": "review"
    },
    "review": {
      "name": "Review",
      "kind": "worker",
      "input": {
        "prompt": [
          "Review implementation.",
          "",
          "Implementation result:",
          "${{ input.implement.results }}",
          "",
          "Implementation artifacts:",
          "${{ input.implement.artifacts | default: \"No implementation artifacts.\" }}"
        ]
      },
      "output": {
        "template": "output.md",
        "schema": "schemas/routing-review.schema.json"
      },
      "next": {
        "match": "${{ output.outcome }}",
        "cases": {
          "ready": "done",
          "retry": "implement"
        }
      }
    },
    "done": {
      "name": "Done",
      "kind": "done",
      "input": {
        "prompt": "Finished."
      }
    }
  }
}
